{
  "source_page_size_pt": [
    1190.52,
    841.92
  ],
  "split_x_pt": 595.26,
  "page1_lines": [
    {
      "x0": 66.984,
      "y0": 64.58,
      "x1": 555.914,
      "y1": 64.58,
      "width": 1.0,
      "dash_pattern": [],
      "dash_phase": 0.0,
      "cap": 2,
      "join": 1,
      "color": [
        0.0,
        0.0,
        0.0
      ]
    },
    {
      "x0": 66.98,
      "y0": 64.584,
      "x1": 66.98,
      "y1": 473.474,
      "width": 1.0,
      "dash_pattern": [],
      "dash_phase": 0.0,
      "cap": 2,
      "join": 1,
      "color": [
        0.0,
        0.0,
        0.0
      ]
    },
    {
      "x0": 67.94,
      "y0": 64.584,
      "x1": 67.94,
      "y1": 473.474,
      "width": 1.0,
      "dash_pattern": [],
      "dash_phase": 0.0,
      "cap": 2,
      "join": 1,
      "color": [
        0.0,
        0.0,
        0.0
      ]
    },
    {
      "x0": 148.46,
      "y0": 64.584,
      "x1": 148.46,
      "y1": 472.514,
      "width": 1.0,
      "dash_pattern": [],
      "dash_phase": 0.0,
      "cap": 2,
      "join": 1,
      "color": [
        0.0,
        0.0,
        0.0
      ]
    },
    {
      "x0": 149.42,
      "y0": 64.584,
      "x1": 149.42,
      "y1": 472.514,
      "width": 1.0,
      "dash_pattern": [],
      "dash_phase": 0.0,
      "cap": 2,
      "join": 1,
      "color": [
        0.0,
        0.0,
        0.0
      ]
    },
    {
      "x0": 554.95,
      "y0": 64.584,
      "x1": 554.95,
      "y1": 472.514,
      "width": 1.0,
      "dash_pattern": [],
      "dash_phase": 0.0,
      "cap": 2,
      "join": 1,
      "color": [
        0.0,
        0.0,
        0.0
      ]
    },
    {
      "x0": 555.91,
      "y0": 64.584,
      "x1": 555.91,
      "y1": 473.47,
      "width": 1.0,
      "dash_pattern": [],
      "dash_phase": 0.0,
      "cap": 2,
      "join": 1,
      "color": [
        0.0,
        0.0,
        0.0
      ]
    },
    {
      "x0": 67.04,
      "y0": 64.644,
      "x1": 67.04,
      "y1": 473.41,
      "width": 0.14,
      "dash_pattern": [],
      "dash_phase": 0.0,
      "cap": 2,
      "join": 1,
      "color": [
        0.0,
        0.0,
        0.0
      ]
    },
    {
      "x0": 148.52,
      "y0": 64.644,
      "x1": 148.52,
      "y1": 472.45,
      "width": 0.14,
      "dash_pattern": [],
      "dash_phase": 0.0,
      "cap": 2,
      "join": 1,
      "color": [
        0.0,
        0.0,
        0.0
      ]
    },
    {
      "x0": 555.01,
      "y0": 64.644,
      "x1": 555.01,
      "y1": 472.45,
      "width": 0.14,
      "dash_pattern": [],
      "dash_phase": 0.0,
      "cap": 2,
      "join": 1,
      "color": [
        0.0,
        0.0,
        0.0
      ]
    },
    {
      "x0": 68.004,
      "y0": 65.48,
      "x1": 555.85,
      "y1": 65.48,
      "width": 0.14,
      "dash_pattern": [],
      "dash_phase": 0.0,
      "cap": 2,
      "join": 1,
      "color": [
        0.0,
        0.0,
        0.0
      ]
    },
    {
      "x0": 67.944,
      "y0": 65.54,
      "x1": 555.914,
      "y1": 65.54,
      "width": 1.0,
      "dash_pattern": [],
      "dash_phase": 0.0,
      "cap": 2,
      "join": 1,
      "color": [
        0.0,
        0.0,
        0.0
      ]
    },
    {
      "x0": 122.66,
      "y0": 65.544,
      "x1": 122.66,
      "y1": 472.51,
      "width": 1.0,
      "dash_pattern": [],
      "dash_phase": 0.0,
      "cap": 2,
      "join": 1,
      "color": [
        0.0,
        0.0,
        0.0
      ]
    },
    {
      "x0": 122.78,
      "y0": 65.544,
      "x1": 122.78,
      "y1": 472.51,
      "width": 1.0,
      "dash_pattern": [],
      "dash_phase": 0.0,
      "cap": 2,
      "join": 1,
      "color": [
        0.0,
        0.0,
        0.0
      ]
    },
    {
      "x0": 122.72,
      "y0": 65.604,
      "x1": 122.72,
      "y1": 472.45,
      "width": 0.14,
      "dash_pattern": [],
      "dash_phase": 0.0,
      "cap": 2,
      "join": 1,
      "color": [
        0.0,
        0.0,
        0.0
      ]
    },
    {
      "x0": 67.944,
      "y0": 90.38,
      "x1": 555.914,
      "y1": 90.38,
      "width": 1.0,
      "dash_pattern": [],
      "dash_phase": 0.0,
      "cap": 2,
      "join": 1,
      "color": [
        0.0,
        0.0,
        0.0
      ]
    },
    {
      "x0": 68.004,
      "y0": 91.28,
      "x1": 555.85,
      "y1": 91.28,
      "width": 0.14,
      "dash_pattern": [],
      "dash_phase": 0.0,
      "cap": 2,
      "join": 1,
      "color": [
        0.0,
        0.0,
        0.0
      ]
    },
    {
      "x0": 67.944,
      "y0": 91.34,
      "x1": 555.914,
      "y1": 91.34,
      "width": 1.0,
      "dash_pattern": [],
      "dash_phase": 0.0,
      "cap": 2,
      "join": 1,
      "color": [
        0.0,
        0.0,
        0.0
      ]
    },
    {
      "x0": 67.944,
      "y0": 116.18,
      "x1": 555.914,
      "y1": 116.18,
      "width": 1.0,
      "dash_pattern": [],
      "dash_phase": 0.0,
      "cap": 2,
      "join": 1,
      "color": [
        0.0,
        0.0,
        0.0
      ]
    },
    {
      "x0": 68.004,
      "y0": 117.08,
      "x1": 555.85,
      "y1": 117.08,
      "width": 0.14,
      "dash_pattern": [],
      "dash_phase": 0.0,
      "cap": 2,
      "join": 1,
      "color": [
        0.0,
        0.0,
        0.0
      ]
    },
    {
      "x0": 67.944,
      "y0": 117.14,
      "x1": 555.914,
      "y1": 117.14,
      "width": 1.0,
      "dash_pattern": [],
      "dash_phase": 0.0,
      "cap": 2,
      "join": 1,
      "color": [
        0.0,
        0.0,
        0.0
      ]
    },
    {
      "x0": 67.944,
      "y0": 141.98,
      "x1": 555.914,
      "y1": 141.98,
      "width": 1.0,
      "dash_pattern": [],
      "dash_phase": 0.0,
      "cap": 2,
      "join": 1,
      "color": [
        0.0,
        0.0,
        0.0
      ]
    },
    {
      "x0": 68.004,
      "y0": 142.88,
      "x1": 555.85,
      "y1": 142.88,
      "width": 0.14,
      "dash_pattern": [],
      "dash_phase": 0.0,
      "cap": 2,
      "join": 1,
      "color": [
        0.0,
        0.0,
        0.0
      ]
    },
    {
      "x0": 67.944,
      "y0": 142.94,
      "x1": 555.914,
      "y1": 142.94,
      "width": 1.0,
      "dash_pattern": [],
      "dash_phase": 0.0,
      "cap": 2,
      "join": 1,
      "color": [
        0.0,
        0.0,
        0.0
      ]
    },
    {
      "x0": 67.944,
      "y0": 167.78,
      "x1": 555.914,
      "y1": 167.78,
      "width": 1.0,
      "dash_pattern": [],
      "dash_phase": 0.0,
      "cap": 2,
      "join": 1,
      "color": [
        0.0,
        0.0,
        0.0
      ]
    },
    {
      "x0": 68.004,
      "y0": 168.68,
      "x1": 555.85,
      "y1": 168.68,
      "width": 0.14,
      "dash_pattern": [],
      "dash_phase": 0.0,
      "cap": 2,
      "join": 1,
      "color": [
        0.0,
        0.0,
        0.0
      ]
    },
    {
      "x0": 67.944,
      "y0": 168.74,
      "x1": 555.914,
      "y1": 168.74,
      "width": 1.0,
      "dash_pattern": [],
      "dash_phase": 0.0,
      "cap": 2,
      "join": 1,
      "color": [
        0.0,
        0.0,
        0.0
      ]
    },
    {
      "x0": 67.944,
      "y0": 193.58,
      "x1": 555.914,
      "y1": 193.58,
      "width": 1.0,
      "dash_pattern": [],
      "dash_phase": 0.0,
      "cap": 2,
      "join": 1,
      "color": [
        0.0,
        0.0,
        0.0
      ]
    },
    {
      "x0": 68.004,
      "y0": 194.48,
      "x1": 555.85,
      "y1": 194.48,
      "width": 0.14,
      "dash_pattern": [],
      "dash_phase": 0.0,
      "cap": 2,
      "join": 1,
      "color": [
        0.0,
        0.0,
        0.0
      ]
    },
    {
      "x0": 67.944,
      "y0": 194.54,
      "x1": 555.914,
      "y1": 194.54,
      "width": 1.0,
      "dash_pattern": [],
      "dash_phase": 0.0,
      "cap": 2,
      "join": 1,
      "color": [
        0.0,
        0.0,
        0.0
      ]
    },
    {
      "x0": 67.944,
      "y0": 219.26,
      "x1": 555.914,
      "y1": 219.26,
      "width": 1.0,
      "dash_pattern": [],
      "dash_phase": 0.0,
      "cap": 2,
      "join": 1,
      "color": [
        0.0,
        0.0,
        0.0
      ]
    },
    {
      "x0": 68.004,
      "y0": 220.16,
      "x1": 555.85,
      "y1": 220.16,
      "width": 0.14,
      "dash_pattern": [],
      "dash_phase": 0.0,
      "cap": 2,
      "join": 1,
      "color": [
        0.0,
        0.0,
        0.0
      ]
    },
    {
      "x0": 67.944,
      "y0": 220.22,
      "x1": 555.914,
      "y1": 220.22,
      "width": 1.0,
      "dash_pattern": [],
      "dash_phase": 0.0,
      "cap": 2,
      "join": 1,
      "color": [
        0.0,
        0.0,
        0.0
      ]
    },
    {
      "x0": 67.944,
      "y0": 245.09,
      "x1": 555.914,
      "y1": 245.09,
      "width": 1.0,
      "dash_pattern": [],
      "dash_phase": 0.0,
      "cap": 2,
      "join": 1,
      "color": [
        0.0,
        0.0,
        0.0
      ]
    },
    {
      "x0": 68.004,
      "y0": 245.99,
      "x1": 555.85,
      "y1": 245.99,
      "width": 0.14,
      "dash_pattern": [],
      "dash_phase": 0.0,
      "cap": 2,
      "join": 1,
      "color": [
        0.0,
        0.0,
        0.0
      ]
    },
    {
      "x0": 67.944,
      "y0": 246.05,
      "x1": 555.914,
      "y1": 246.05,
      "width": 1.0,
      "dash_pattern": [],
      "dash_phase": 0.0,
      "cap": 2,
      "join": 1,
      "color": [
        0.0,
        0.0,
        0.0
      ]
    },
    {
      "x0": 67.944,
      "y0": 270.89,
      "x1": 555.914,
      "y1": 270.89,
      "width": 1.0,
      "dash_pattern": [],
      "dash_phase": 0.0,
      "cap": 2,
      "join": 1,
      "color": [
        0.0,
        0.0,
        0.0
      ]
    },
    {
      "x0": 68.004,
      "y0": 271.79,
      "x1": 555.85,
      "y1": 271.79,
      "width": 0.14,
      "dash_pattern": [],
      "dash_phase": 0.0,
      "cap": 2,
      "join": 1,
      "color": [
        0.0,
        0.0,
        0.0
      ]
    },